"NAME OF CONTRIBUTOR"	"CITY"	"STATE/ZIP"	"ID NUMBER"	"EMPLOYER"	"OCCUPATION"	"AMOUNT"	"TRANSACTION TYPE"	"TYPE"	"TRANS. DATE"	"FILED DATE"	"TRANS #"
"CALIFORNIA TEACHERS ASSOCIATION ISSUES PAC"	"BURLINGAME"	"CA / 94010"	"880873"	""	""	"         $500,000.00"	"LATE CONTRIBUTION RECEIVED"	"INITIAL"	"08/27/2018"	"08/28/2018"	"2287114-INC14"
"CALIFORNIA PROFESSIONAL FIREFIGHTERS BALLOT ISSUES COMMITTEE"	"SACRAMENTO"	"CA / 95814"	"861767"	""	""	"          $15,000.00"	"LATE CONTRIBUTION RECEIVED"	"INITIAL"	"08/27/2018"	"08/28/2018"	"2287114-INC13"
"CALIFORNIA FEDERATION OF TEACHERS COPE PROP/BALLOT COMMITTEE"	"BURBANK"	"CA / 91505"	"1240104"	""	""	"          $75,000.00"	"LATE CONTRIBUTION RECEIVED"	"INITIAL"	"08/14/2018"	"08/14/2018"	"2283050-INC10"
"SEIU CALIFORNIA STATE COUNCIL POLITICAL COMMITTEE"	"SACRAMENTO"	"CA / 95814"	"1258324"	""	""	"       $1,000,000.00"	"LATE CONTRIBUTION RECEIVED"	"INITIAL"	"08/14/2018"	"08/14/2018"	"2283050-IDT1"
"CALIFORNIA FEDERATION OF TEACHERS COPE PROP/BALLOT COMMITTEE"	"BURBANK"	"CA / 91505"	"1240104"	""	""	"          $15,000.00"	"LATE CONTRIBUTION RECEIVED"	"INITIAL"	"07/11/2018"	"07/13/2018"	"2264691-INC1"


